Title,Date Published,Author(s),URL,300-word Summary
Transportation Security: Background and Issues for the 119th Congress,5/23/25,Bart Elias; John Frittelli; Ben Goldman; Chris Jaikaran; Jennifer J. Marshall; Paul W. Parfomak,www.congress.gov/crs-report/R48543,"The nation’s aviation, mass transit, passenger and freight rail, maritime, and pipeline transportation systems are geographically dispersed and designed for accessibility and efficiency. These characteristics make them vulnerable to attack. While securing the transportation sector is difficult, measures can be taken to deter attackers. A key challenge facing Congress is how to implement and finance a system of deterrence, protection, and response that effectively reduces the likelihood and mitigates the consequences of attacks without interfering with travel, commerce, and civil liberties. Transportation security has been a major policy focus since the terrorist attacks of September 11, 2001. In the aftermath of those attacks, Congress passed the Aviation and Transportation Security Act (ATSA; P.L. 107-71). ATSA established the Transportation Security Administration (TSA), mandated federal screening of airline passengers and their baggage, and ordered the deployment of air marshals on all high-risk commercial passenger flights. Congress has since passed legislation intended to further enhance transportation security measures. The FAA Extension, Safety, and Security Act of 2016 (P.L. 114-190) and the TSA Modernization Act (P.L. 115-254, Division K) included provisions intended to improve screening technologies, streamline passenger screening, mandate more rigorous background checks of airport workers, strengthen airport access controls, increase passenger checkpoint efficiency, and enhance security in public areas of airports and at foreign airports where flights depart for the United States. Numerous challenges remain regarding aviation and transportation security, including developing and deploying capabilities, including the potential use of biometrics, to verify the identities of transportation workers and travelers; developing risk-based approaches to vetting and screening transportation workers who access secured areas of airports and other sensitive areas of transportation networks; developing cost-effective solutions to screen air cargo and freight without impeding the flow of commerce; and improving coordination among state, local, and federal homeland security and law enforcement personnel to..."
The Retirement Savings Contribution Credit and the Saver’s Match,9/4/25,Brendan McDermott,www.congress.gov/crs-report/IF11159,"The Retirement Savings Contribution Credit (Internal Revenue Code [IRC] §25B)—commonly referred to as the Saver’s Credit—is a tax expenditure meant to encourage low- and moderate-income taxpayers to save for retirement. The SECURE 2.0 Act of 2022 (“SECURE 2.0”; Division T of P.L. 117-328) created a Saver’s Match, scheduled to largely replace the Saver’s Credit beginning in 2027. This In Focus describes these two subsidies for saving and their effects (actual or potential) on saving. The Saver’s Credit Eligible taxpayers can claim a nonrefundable tax credit for contributions to certain retirement accounts. The Economic Growth and Tax Relief Reconciliation Act of 2001 (EGTRRA; P.L. 107-16) created the Saver’s Credit. The credit took effect in 2002 and was scheduled to expire after 2006, but the Pension Protection Act of 2006 (P.L. 109-290) made it permanent. To claim the tax credit, the saver must (1) be at least 18 years old; (2) not be claimed as a dependent on someone else’s tax return; (3) not be a full-time student; and (4) fall under specified income thresholds. The maximum credit amount is $1,000 per person (up to $2,000 per married couple filing jointly). Taxpayers calculate the credit by multiplying their qualified retirement account contributions (up to a limit) by a credit rate (which declines as income rises). The credit is nonrefundable, meaning the credit cannot exceed income tax liability. Since low-income taxpayers typically owe little to no income tax, nonrefundable credits like the Saver’s Credit may have little to no effect on their tax liability. Retirement account contributions of up to $2,000 per person qualify for the credit. Eligible contributions include those to traditional and Roth Individual Retirement Accounts (IRAs) and defined contribution (DC) retirement plans, such as 401(k) plans. P.L. 115-97 let taxpayers claim the Saver’s Credit for contributions to their own Achieving..."
The Cruel and Unusual Punishments Clause’s Substantive Limits on Criminal Laws,9/4/25,Dave S. Sidhu,www.congress.gov/crs-report/R48692,"Criminal law marks a boundary between conduct that society deems permissible and behavior that it deems worthy of punishment. Courts have expressed that those who cross the line may be subject to penalty and social disapproval. In addition to fines and imprisonment, transgressors may face wide-ranging collateral consequences. The authority of the government to impose criminal punishment is not unlimited. The Eighth Amendment to the U.S. Constitution serves as one restraint on that authority. As relevant here, the Eighth Amendment forbids the government from subjecting individuals to “cruel and unusual punishments.” This prohibition applies on its own terms to federal criminal laws and, by operation of the Fourteenth Amendment, also applies to states and their political subdivisions. Enacted in 1791, the “Cruel and Unusual Punishments” Clause operates to bar the imposition of some forms of punishments for particular offenses (e.g., death for non-murder offenses or treason) or classes of offenders (e.g., death for the intellectually disabled or juveniles). In the 1960s, the Supreme Court issued twin decisions—in Robinson v. California, 370 U.S. 660 (1962) and Powell v. Texas, 392 U.S. 514 (1968)—that also articulated a substantive component to the Cruel and Unusual Punishments Clause, limiting not only what punishments may follow a criminal conviction but also what a government may criminalize to begin with. Robinson and Powell addressed whether imposing criminal punishment on individuals with an addiction to alcohol or narcotics violated the Cruel and Unusual Punishments Clause. These cases gave rise to confusion in the lower courts as to whether, among other things, the Clause created a status-conduct distinction, meaning the Clause outlaws only the punishment of an individual’s status (e.g., “being an addict”) but is not offended if a government punishes some identifiable conduct (e.g., “being intoxicated in public”). It was not until 2024, in City of Grants..."
National Oceanic and Atmospheric Administration (NOAA) FY2026 Budget Request and Appropriations,9/5/25,Caitlin Keating-Bitonti; Eva Lipiec,www.congress.gov/crs-report/IF13024,"The National Oceanic and Atmospheric Administration (NOAA) is an agency in the Department of Commerce. NOAA’s mission, as defined by the agency, is to understand and predict changes in climate, weather, oceans, and coasts; to share that information; and to conserve and manage coastal and marine ecosystems and resources. In March 2025, Congress passed and the President signed into law a full-year continuing resolution of discretionary appropriations for NOAA for the remainder of FY2025 (P.L. 119-4). For FY2026, the Administration is requesting a decrease in funding for NOAA broadly, with proposals to eliminate funding for climate-related offices and programs, among other changes. NOAA’s work is divided among six line offices: National Environmental Satellite, Data, and Information Service (NESDIS); National Marine Fisheries Service (NMFS); National Ocean Service (NOS); National Weather Service (NWS); Office of Oceanic and Atmospheric Research (OAR); and Office of Marine and Aviation Operations (OMAO). NOAA’s Mission Support provides planning, leadership, finances, information technology, educational programming, and other support across the line offices. Congress typically provides NOAA with annual mandatory and discretionary appropriations. Mandatory appropriations, which generally comprise a small percentage of total NOAA funding, are disbursed to various accounts that support programs in NOS, NMFS, and OMAO. NOAA’s discretionary appropriations typically are included in annual Commerce, Justice, Science, and Related Agencies (CJS) appropriations laws. Discretionary appropriations support two broad accounts—Operations, Research, and Facilities (ORF) and Procurement, Acquisition, and Construction (PAC)—and a few smaller accounts. Annual appropriations are one part of the agency’s discretionary direct obligations or funding level, which also include transfers and recoveries from prior year obligations. For more about NOAA’s budget structure, see CRS Report R48157, National Oceanic and Atmospheric Administration (NOAA) Budget and Funding: Overview and Issues for Congress. Agency Funding NOAA has requested between $4.7 billion and $7.2 billion in nominal dollars per year..."
"Unemployment Compensation, Labor Disputes, and Strikes",4/11/24,Julie M. Whittaker; Katelin P. Isaacs,www.congress.gov/crs-report/IF12633,"Introduction Labor disputes among workers and employers may involve temporary work stoppages. Strikes occur when workers initiate the work stoppage. Lockouts happen when employers refuse to allow employees to work. For 2023, the U.S. Bureau of Labor Statistics (BLS) reported that a total of 33 major work stoppages involving 1,000 or more workers began, impacting approximately 458,900 workers. This is the largest number of major work stoppages since 2000 (when there were 39). Because of the complexity of most labor disputes, BLS’ estimates do not distinguish between strikes and lockouts in its work stoppage statistics. Workers involved in a strike or lockout may or may not be members of a union. In the case of strikes or lockouts involving union members, unions may provide their members with payments in the form of strike assistance if they have the financial resources to do so. Additionally, there has been state and federal legislation introduced to provide striking workers with income replacement through the Unemployment Compensation (UC) program. This In Focus discusses the role of UC in labor disputes and strikes, including current UC eligibility and disqualification related to labor disputes as well as examples of recent state and federal legislation to expand UC access in labor dispute situations. It also summarizes the role of union strike assistance. Unemployment Compensation The joint federal-state UC program provides income support through UC benefit payments. The UC program is financed through employer taxes imposed by the Federal Unemployment Tax Act (FUTA) and state payroll taxes required under each state’s State Unemployment Tax Act (SUTA). Although there are broad requirements under federal law regarding UC benefits and financing, state specifics are set out under each state’s laws. States administer UC benefits with U.S. Department of Labor (DOL) oversight, resulting in 53 different UC programs operated in the..."
Centro de Trabajadores Unidos v. Bessent: D.C. Circuit Considers IRS-ICE Information-Sharing Agreement,9/4/25,Justin C. Chung,www.congress.gov/crs-report/LSB11359,"On April 7, 2025, the Internal Revenue Service (IRS) and Immigration and Customs Enforcement (ICE) entered into a Memorandum of Understanding (MOU or information-sharing agreement) to establish procedures between the two agencies to share information for the enforcement of criminal immigration laws. Four organizations that serve immigrants (plaintiffs) have filed a lawsuit (Centro de Trabajadores Unidos v. Bessent) against the government and asked the court to stop the information sharing, alleging that the agreement violates the statutorily provided confidentiality of federal tax returns and return information. The U.S. District Court for the District of Columbia denied the plaintiffs’ request for a preliminary injunction, finding in part that the government is likely to succeed on its argument that the MOU comports with an exception to such confidentiality for disclosures for nontax criminal investigations and proceedings. The plaintiffs have appealed the denial of the preliminary injunction to the U.S. Court of Appeals for the D.C. Circuit. Oral argument is scheduled for October 3. This Legal Sidebar discusses the confidentiality of federal tax returns and return information and the exception to such confidentiality at issue in the case. It gives background on the IRS-ICE MOU and what the MOU requires from each agency. It then summarizes the parties’ arguments before the appeals court. Finally, it presents considerations for Congress. Although this Sidebar does not address a separate lawsuit filed by a taxpayer rights group over the Department of Government Efficiency’s access to IRS data, many of the arguments raised by the taxpayer rights group in a motion in that case against the MOU are similar to the plaintiffs’ arguments in Centro de Trabajadores Unidos. Confidentiality of Federal Tax Returns and Return Information Section 6103 of the Internal Revenue Code (I.R.C.) establishes that federal tax returns and return information are confidential by default unless..."
United States National Symbols: Congressional Designation and Past Practices,9/4/25,Jacob R. Straus,www.congress.gov/crs-report/IF13097,"As codified in Title 36 of the U.S. Code, Congress has designated a national anthem (“The Star-Spangled Banner”), a national motto (“In God we trust”), a national floral emblem (the rose), a national march (“The Stars and Stripes Forever”), a national tree (oak), a national mammal (North American bison), and a national bird (bald eagle). These recognitions can be referred to as “National Symbols,” even though the term does not appear to have a specific statutory definition. [T]he bald eagle has long been associated with and a symbol of the United States. It was first adopted in the Great Seal of the United States in 1782. Versions of the Great Seal are used in the Seal of the President of the United States, the House of Representatives, the Senate, and by countless Federal agencies and departments. The bald eagle appears on the flags and insignia of our military, on our passports, and on our currency. It appears on the flags and the seals of several States as well. The bald eagle is also important to Native American Tribes across the United States. It plays a key role in sacred belief systems and traditions, stories, ceremonies, and insignias. Despite this long and intertwined history of the United States, the bald eagle has not been officially designated as our national bird.... This bill would ... enshrine the bald eagle as the national bird along with our national anthem, national motto, and other symbols of our country. —Representative Russell Fry, Congressional Record, December 16, 2024, p. H7171. National Symbols of the United States National Anthem In 1931, Congress designated “The Star-Spangled Banner” as the national anthem (36 U.S.C. §301). Written in 1814 by Francis Scott Key near Fort McHenry, Maryland, during the War of 1812, “The Star-Spangled Banner” described the attack on the..."
The Indian Prime Minister’s 2025 Visit to China and India-China Relations,9/4/25,Ricardo Barrios; K. Alan Kronstadt,www.congress.gov/crs-report/IN12604,"On August 31, 2025, India’s Prime Minister (PM) Narendra Modi traveled to the People’s Republic of China (PRC, or China), where he met PRC leader Xi Jinping. The visit—Modi’s first to China in seven years—took place as numerous analysts in the United States and India expressed concerns that current U.S. policies (including secondary sanctions on India for ongoing purchases of Russian oil), and remarks made by President Donald Trump and his advisors. have put the two-decades-old U.S.-India partnership at risk. The international press portrayed the Xi-Modi meeting as a rapprochement driven by a common opposition to U.S. policies. Congress for the past two decades has offered broad support for successive administrations’ efforts to develop the strategic partnership with India, the world’s largest democracy and fifth-largest economy, in part to address China’s growing influence in the Indo-Pacific. Xi, Modi Signal Willingness to Cooperate PM Modi met with Xi on August 31 on the sidelines of the annual summit of the Shanghai Cooperation Organization. According to official readouts, Modi and Xi affirmed that India and China are “partners” and not “rivals,” and Modi “deemed it necessary to expand common ground.” The two each held separate meetings with President Vladimir Putin of Russia, suggesting that the three leaders wish to signal their commitment to a multipolar rather than U.S.-centric order. India and China together account for more than one-third of the global population and one-fifth of global GDP, and they share millennia-old ties and extensive, if asymmetric, commercial relations. China is a major source of imports for India, which relies on China for electronic goods and consumer durables. Two-way trade reached $128 billion in 2024, making China India’s second-largest trading partner after the United States. The two countries exhibit some mutual dependence: India relies on China for advanced electronics, pharmaceutical ingredients, and rare..."
U.S.-Japan Critical Minerals Agreement: Background and Issues for Congress,9/3/25,Kyla H. Kitamura,www.congress.gov/crs-report/R48676,"Amid growing global demand for critical minerals, Congress has been deliberating how to secure U.S. access to such goods. The United States has become highly reliant on foreign imports of critical minerals, and Members of Congress have expressed interest in both encouraging U.S. production capacity, through measures such as tariffs and federal incentives, and increasing collaboration with trading partners to secure critical minerals from countries around the world, including through sectoral trade agreements such as critical minerals agreements (CMAs). According to the International Energy Agency, international critical mineral supply chains face a high risk of disruptions from weather, trade barriers, and geopolitical factors. In addition, mining and processing being concentrated in a small number of countries makes critical minerals supply chains more vulnerable to disruptions. The People’s Republic of China (PRC, or China) now has a dominant role in global critical minerals supply chains. China and PRC firms control a large share of global mining and processing of critical minerals, as well as production of key downstream goods—for example, in 2024, China produced 72% of global EVs, and PRC firms owned 85% of global EV battery manufacturing capacity. In March 2023, during the Biden Administration, the United States and Japan signed a CMA covering five key minerals related to the production of batteries for electric vehicles (EVs). In the U.S.-Japan CMA, the United States and Japan agreed to confer on measures related to critical minerals trade and investment in their respective countries, including discouraging the importation of goods made with forced labor and affirming their participation in the development of international standards on critical minerals, among other things. The U.S.-Japan CMA entered into force immediately upon signature. The U.S.-Japan CMA was negotiated after Japan raised concerns about being excluded from certain content requirements for consumer tax credits in P.L. 117-169,..."
The Pacific Coastal Salmon Recovery Fund,9/4/25,Anthony R. Marshak,www.congress.gov/crs-report/IF13096,"Introduction The Pacific Coastal Salmon Recovery Fund (PCSRF) provides federal funding for the protection, conservation, and restoration of Pacific salmon species (Oncorhynchus spp.) and steelhead trout (O. mykiss) that are listed or at risk of being listed as threatened or endangered under the Endangered Species Act (ESA; 16 U.S.C. §§1531-1544). Specifically, the PCSRF supports West Coast Pacific salmon recovery efforts by providing grants to the states of Washington, Oregon, Idaho, Nevada, California, and Alaska and to federally recognized Tribes of the Columbia River and Pacific Coast. The National Oceanic and Atmospheric Administration’s (NOAA’s) National Marine Fisheries Service (NMFS) administers the PCSRF. Currently, 17 evolutionarily significant units of Pacific salmon and 11 distinct population segments of steelhead trout are listed under the ESA (Table 1). Other species at risk of being listed and potentially eligible for assistance through the PCSRF might include state-designated salmonids of concern (e.g., by the State of California). Table 1. Pacific Salmon and Steelhead Trout Population Groups Listed Under the Endangered Species Act Species Number of ESUs or DPSs Geographies of ESUs or DPSs Chinook Salmon (Oncorhynchus tshawytscha) 9 ESUs Coastal CA, CCV, CR (Lower, Upper), PS, Sacr R, SR, UWR Chum Salmon (O. keta) 2 ESUs CR, HC Coho Salmon (O. kisutch) 4 ESUs Central CA Coast, CR (Lower), OR Coast, Southern OR / Northern CA Coast Sockeye Salmon (O. nerka) 2 ESUs OL, SR Steelhead Trout (O. mykiss) 11 DPSs CCV, CR (Lower, Middle, Upper), CA Coast (Northern, Central, South-Central, Southern), PS, SR Basin, UWR Source: CRS, using information from NMFS, “Pacific Salmon and Steelhead: ESA Protected Species.” Notes: CA = California; CCV = California Central Valley; CR = Columbia River; DPS = Distinct Population Segment; ESU = Evolutionarily Significant Unit; HC = Hood Canal; OL = Ozette Lake; OR = Oregon; PS = Puget..."
Mid-Decade Congressional Redistricting: Key Issues,8/11/25,Sarah J. Eckman; L. Paige Whitaker,www.congress.gov/crs-report/IF13082,"States typically begin their congressional redistricting processes following the decennial U.S. census and apportionment, at which point states with multiple House seats draw congressional district boundaries to account for population changes in the intervening decade. After redistricting plans are enacted, states may face legal challenges regarding elements of their plans; these lawsuits can continue for a number of years and result in courts approving subsequent modifications to states’ congressional district maps. Aside from these court-ordered redistricting efforts, many states have not typically undergone significant redistricting efforts until after the next decennial census. On July 30, 2025, state legislators in Texas presented a new proposed congressional district map, which is currently under consideration in a 30-day special session of the Texas state legislature. State officials in several other states, including California, Florida, New York, and Missouri, are reportedly considering the possibility of redrawing their congressional district boundaries before the 2030 census. This practice is often referred to as mid-decade redistricting. Mid-decade redistricting is prohibited by neither the U.S. Constitution nor federal law. Congressional Apportionment and Redistricting Background Article I, Section 2, of the U.S. Constitution, as amended by Section 2 of the Fourteenth Amendment, requires that representation in the House of Representatives is based on state population size, as determined by a national census conducted within each 10-year period. Dividing House seats among the 50 states is referred to as apportionment; determining where district boundaries exist within a state is referred to as redistricting. The Constitution does not specify how House seats are to be distributed within each state, but it does limit the number of Representatives to no more than one for every 30,000 persons, provided that each state receives at least one Representative. States largely set, and can potentially revise, their own practices for redistricting, including its timing, and..."
