Title,Date Published,Author(s),URL,300-word Summary
Advances in DNA Analysis: Fourth Amendment Implications,7/11/25,Peter G. Berris,www.congress.gov/crs-report/LSB11339,"Law enforcement has used deoxyribonucleic acid, or DNA, as an investigative tool for decades. DNA is “the fundamental building block for an individual’s entire genetic makeup” and may be “extracted from many sources, such as hair, bone, teeth, saliva, and blood.” Investigators routinely compare DNA from known suspects with DNA recovered from crime scenes or victims, or look for matches between crime scene DNA and law enforcement databases of offender DNA profiles. Federal courts, including the Supreme Court, have generally upheld statutory DNA identification regimes against Fourth Amendment challenges. This Sidebar provides legal background on DNA identification and the Fourth Amendment, with particular emphasis on the 2013 Supreme Court case Maryland v. King. It then examines selected Fourth Amendment issues, including lingering questions from King that could potentially be relevant to a newer DNA investigative technique, which the Department of Justice (DOJ) has called forensic genetic genealogical DNA analysis and searching (sometimes described as investigative genetic genealogy or forensic genetic genealogy). The Sidebar concludes with congressional considerations. Maryland v. King: the Fourth Amendment and DNA Identification The Fourth Amendment imposes limits on searches and seizures by the government. Courts have determined that a Fourth Amendment search occurs if “the Government obtains information by physically intruding on a constitutionally protected area” or “when the government violates a subjective expectation of privacy that society recognizes as reasonable.” If a law enforcement activity qualifies as a search or seizure, then the Fourth Amendment requires that it must be reasonable, which ordinarily means that the search or seizure must be conducted pursuant to a warrant supported by probable cause, with some exceptions. Combined DNA Index System (CODIS) A prominent use of DNA by law enforcement is comparing biological material believed to be “deposited by a putative perpetrator” and “collected from a crime scene, a..."
Private Sector: Accounting and Auditing Regulatory Structure,8/26/25,Raj Gnanarajah,www.congress.gov/crs-report/R48647,"In the United States, accounting and auditing standards are promulgated and regulated by various federal, state, and self-regulatory agencies. Accounting and auditing standards are also influenced by practitioners from businesses, nonprofits, and government entities (federal, state, and local). Many of the foundational accounting and auditing concepts are similar across all three sectors. Congress has allowed financial accounting and auditing practitioners in the private sector to remain largely self-regulated while retaining oversight responsibility. At times, Congress has sought to achieve specific accounting- and auditing-based policy objectives by enacting legislation such as the Sarbanes-Oxley Act of 2002 (P.L. 107-204) and Holding Foreign Companies Accountable Act (HFCAA, P.L. 116-222). The accounting and auditing standards created for publicly traded companies (private sector) are subject to oversight by the Securities and Exchange Commission (SEC). Congress has oversight over the SEC and annually appropriates its funding. Throughout its history, the SEC has relied on self-regulatory organizations (SROs) or similar entities to establish financial reporting standards for the private sector known as Generally Accepted Accounting Principles (GAAP). Currently, the SEC recognizes the Financial Accounting Standards Board (FASB) as the designated authority for establishing GAAP. Sarbanes-Oxley created the Public Company Accounting Oversight Board (PCAOB) to oversee the auditing profession for the private sector. The SEC has oversight responsibility over FASB and PCAOB. Some of the ongoing issues that could be of interest to Congress is the accounting treatment of crypto assets. In March 2022, the SEC issued Staff Accounting Bulletin (SAB) 121 to provide guidance for how custodians of crypto assets should record and measure the value of assets they held on behalf of others. One aspect of SAB 121 that surfaced a range of perspectives was its requirement of a crypto asset custodian to record a liability and corresponding asset on its balance sheet. Subsequently, in January..."
Suspension of the Rules: House Practice in the 118th Congress (2023-2024),8/27/25,Jane A. Hudiburg,www.congress.gov/crs-report/R48650,"Suspension of the rules is the most commonly used procedure to call up measures on the floor of the House of Representatives. As the name suggests, the procedure allows the House to suspend its standing and statutory rules in order to consider broadly supported legislation in an expedited manner. More specifically, the House temporarily sets aside its rules that govern the raising and consideration of measures and assumes a new set of constraints particular to the suspension procedure. The suspension of the rules procedure has several parliamentary advantages: (1) it allows non-privileged measures to be raised on the House floor without the need for a special rule, (2) it enables the consideration of a measure that would otherwise be subject to a point of order, and (3) it streamlines floor action by limiting debate and prohibiting floor amendments. Given these features, as well as the required two-thirds supermajority vote for passage, suspension motions are generally used to process less controversial legislation. In the 118th Congress (2023-2024), measures considered under suspension made up 66% of the bills and resolutions that received floor action in the House (681 out of 1,032 measures). The majority of suspension measures were House bills (80%), followed by Senate bills (14%), House resolutions (5%), and House concurrent resolutions (1%). The measures covered a variety of policy areas but most often addressed government operations, such as the designation of federal facilities or amending administrative policies. However, suspension procedure also governed the consideration of some major appropriations bills, which are commonly considered pursuant to a special rule. Most suspension measures are referred to at least one House committee before their consideration on the floor. The House Committee on Oversight and Accountability served as the committee of primary jurisdiction for the most suspension measures in the 118th Congress. Additional committees—such..."
FISA Section 702 and the 2024 Reforming Intelligence and Securing America Act,7/8/25,Andreas Kuersten,www.congress.gov/crs-report/R48592,"Section 702 of the Foreign Intelligence Surveillance Act (FISA) provides a legal framework under which the U.S. government can conduct electronic surveillance of non-U.S. persons abroad. This surveillance is authorized programmatically rather than individually. That is, the Foreign Intelligence Surveillance Court authorizes the government to carry out this surveillance within approved parameters for up to one year at a time. The government does not have to seek court authorization for every individual it targets. These authorizations also address the procedures pursuant to which the government can search (i.e., query) information collected under Section 702. Congress enacted Section 702 in 2008 with an automatic repeal date (i.e., a sunset date). Since then, Congress has included a sunset date each time it has reauthorized the section. The last time Congress reauthorized Section 702 was on April 20, 2024, via the Reforming Intelligence and Securing America Act (RISAA), which provides that the section will sunset on April 20, 2026. Section 702 has generated significant debate since its inception. This debate tends to intensify as the sunset dates approach, and reauthorizations have historically been the means by which Congress has amended the section. In the run-up to Section 702’s previous sunset date and the RISAA’s enactment, government and private actors shared with Congress a number of concerns about the statute, including the government querying Section 702 data using U.S.-person search terms without warrants, a lack of data on “incidental collection” (i.e., the collection of U.S.-person communications in the course of targeting non-U.S. persons for surveillance under Section 702), and a lack of additional approval procedures for queries potentially targeting politically disfavored individuals or groups. The RISAA extensively amended Section 702, as well as other portions of FISA relevant to Section 702. For example, Congress expanded the definition of foreign intelligence information to include information..."
Defense Primer: International Armaments Cooperation,6/9/23,Christina L. Arabia; Alexandra G. Neenan; Luke A. Nicastro,www.congress.gov/crs-report/IF12425,"What is International Armaments Cooperation? International armaments cooperation (IAC) refers to an array of research, development, testing, and evaluation (RDT&E), procurement, and sustainment partnerships between the U.S. Department of Defense (DOD) and foreign governments, militaries, or commercial entities. IAC encompasses a broad array of activities, ranging from the exchange of basic RDT&E information to multi-billion dollar joint procurement programs. DOD considers IAC to be a form of security cooperation intended to accomplish operational, economic, technological, political, and industrial objectives. Legal and Policy Framework Statutory Authorities The statutory authorities for IAC activities are contained within Titles 10 and 22 of the U.S. Code. Title 10, Chapter 138 contains provisions that authorize: international cross-servicing agreements; international RDT&E agreements and projects; international acquisition agreements and projects; international logistic support agreements; acceptance of foreign financial contributions for cooperative projects; and international test facility agreements. Title 22, Chapter 39 contains provisions that authorize the President to establish international cooperative projects and enter into international loan agreements for research and development purposes. IAC Governance and Stakeholders DOD Directive 5132.03 establishes policy and responsibilities relating to security cooperation activities. The Undersecretary of Defense for Policy is designated as the principal staff assistant to the Defense Secretary for overall security cooperation policy and oversight. The Undersecretary of Defense for Acquisition and Sustainment (USD (A&S)) is responsible for “establish[ing] and maintain[ing] policies for the effective development of international acquisition, technology, and logistics programs, including international armaments cooperation.” The secretaries of the military departments (MILDEPS) are responsible for “conduct[ing] international armaments cooperation with eligible allied and partner nations.” Each MILDEP has a designated office responsible for oversight of IAC projects. For the Department of the Army, this is the Deputy Assistant Secretary of the Army for Defense Exports and Cooperation (DASA DE&C); for the Department of the Navy, this is..."
FY2024 National Security Supplemental Funding: Defense Appropriations,4/25/24,Cameron M. Keys; Luke A. Nicastro,www.congress.gov/crs-report/IN12274,"Background On October 20, 2023, the Biden Administration submitted to Congress a request for FY2024 emergency supplemental appropriations to address “key national security priorities.” President Biden characterized the request as a response to Hamas’ terrorist attacks against Israel and the ongoing Russian invasion of Ukraine, and asked for approximately $58.6 billion in budget authority for the Department of Defense (DOD), as well as funds for other executive departments and agencies (e.g., the Departments of State and Homeland Security). On February 13, 2024, the Senate passed the National Security Act, 2024 (H.R. 815), which would have, among other things, provided approximately $67.3 billion in budget authority to DOD for purposes relating to Ukraine, Israel, and the submarine industrial base. The House did not take up this bill, as passed by the Senate. On April 20, 2024, the House passed a series of bills—including the Israel Security Supplemental Appropriations Act, 2024 (H.R. 8034), the Ukraine Security Supplemental Appropriations Act, 2024 (H.R. 8035), and the Indo-Pacific Security Supplemental Appropriations Act, 2024 (H.R. 8036)—that included approximately $67.3 billion in DOD budget authority for purposes relating to Israel, Ukraine, and the Indo-Pacific. On April 23, 2024, the Senate approved these measures as a consolidated bill (H.R. 815), and on April 24, 2024, President Biden signed this bill into law as P.L. 118-50. The enacted appropriations included funding for military personnel (MILPERS); operation and maintenance (O&M); research, development, test, and evaluation (RDT&E); procurement; and military construction (MILCON) accounts, as well as for Defense Production Act of 1950 (DPA) purchases. P.L. 118-50 also made appropriations for non-defense accounts, and included policy provisions—such as the increase of Presidential Drawdown Authority (PDA; 22 U.S.C. §2318) from $100 million to $7.8 billion for FY2024—relevant to defense issues. Table 1 provides information on requested, proposed, and enacted supplemental FY2024 DOD appropriations...."
"The Defense Production Act of 1950: History, Authorities, and Considerations for Congress",10/6/23,Luke A. Nicastro; Alexandra G. Neenan,www.congress.gov/crs-report/R43767,"The Defense Production Act (DPA) of 1950 (P.L. 81-774, 50 U.S.C. §§4501 et seq.), as amended, confers upon the President a broad set of authorities to influence domestic industry in the interest of national defense. The authorities can be used across the federal government to shape the domestic industrial base so that, when called upon, it is capable of providing essential materials and goods needed for the national defense. Though initially passed in response to the Korean War, the DPA is historically based on the War Powers Acts of World War II. Gradually, Congress has expanded the term national defense, as defined in the DPA. Based on this definition, the scope of DPA authorities now extends beyond shaping U.S. military preparedness and capabilities, as the authorities may also be used to enhance and support domestic preparedness, response, and recovery from natural hazards, terrorist attacks, and other national emergencies. Current DPA authorities include Title I: Priorities and Allocations, which allows the President to require persons (including businesses and corporations) to prioritize and accept contracts for materials and services as necessary to promote the national defense. Title III: Expansion of Productive Capacity and Supply, which allows the President to incentivize the domestic industrial base to expand the production and supply of critical materials and goods. Authorized incentives include loans, loan guarantees, direct purchases and purchase commitments, and the authority to procure and install equipment in private industrial facilities. Title VII: General Provisions, which includes key definitions for the DPA and several distinct authorities, including the authority to establish voluntary agreements with private industry; the authority to block proposed or pending foreign corporate mergers, acquisitions, or takeovers that threaten national security; and the authority to employ persons of outstanding experience and ability and to establish a volunteer pool of industry executives who could..."
Transfer of Defense Articles: U.S. Sale and Export of U.S.-Made Arms to Foreign Entities,3/23/23,Christina L. Arabia; Nathan J. Lucas; Michael J. Vassalotti,www.congress.gov/crs-report/R46337,"An extensive set of laws, regulations, policies, and procedures govern the sale and export of U.S.-origin weapons to foreign countries (“defense articles and defense services,” officially). Congress has authorized such sales under two laws: The Foreign Assistance Act (FAA) of 1961, 22 U.S.C. §2151, et seq. The Arms Export Control Act (AECA) of 1976, 22 U.S.C. §2751, et seq. The FAA and AECA govern all transfers of U.S.-origin defense articles and services, whether they are commercial sales, government-to-government sales, or provided with U.S.-appropriated funds through security assistance/security cooperation programs. These transfers can occur under Title 22 (Foreign Relations) or Title 10 (Armed Services) authorities. Arms sold or transferred under these authorities are regulated by the International Traffic in Arms Regulations (ITAR) and the U.S. Munitions List (USML), which are located in Title 22, Parts 120-130 of the Code of Federal Regulations (C.F.R.). The two main methods for the sale and export of U.S.-made weapons under these authorities are the Foreign Military Sales (FMS) program and Direct Commercial Sales (DCS) licenses. Some other arms sales occur from current Department of Defense (DOD) stocks through Excess Defense Articles (EDA) provisions. For FMS, the U.S. government procures defense articles as an intermediary for international partners’ acquisition of defense articles and defense services, which allows partners to benefit from U.S. DOD technical and operational expertise, procurement infrastructure, and purchasing practices. For DCS, registered U.S. firms may sell defense articles directly to international partners. The U.S. government is not party to the arms agreement, but defense firms must still apply for an export license from the State Department. In some cases where U.S. firms have entered into international partnerships to produce some major weapons systems, comprehensive export regulations under 22 C.F.R. 126.14 are intended to allow exports and technical data for those systems without having..."
"Department of Defense Appropriations Act, 2023: Overview and Selected Issues",1/8/24,Pat Towell; Cameron M. Keys,www.congress.gov/crs-report/R47896,"The annual Department of Defense appropriations act provides discretionary funding for nearly all military-related activities of the Department of Defense (DOD) except the construction of facilities and the provision of family housing for authorized military personnel, which typically are funded in separate appropriations legislation. The Department of Defense Appropriations Act, 2023, enacted as Division C of the Consolidated Appropriations Act, 2023 (P.L. 117-328), provides $788.5 billion in discretionary budget authority, which amounts to $36.0 billion (4.8%) more than the Biden Administration’s $752.4 billion request for programs covered by the act. Compared to the corresponding funding legislation for FY2022, the FY2023 bill provides an increase of $68.9 billion (9.6%) for defense programs (see table below). Neither the House nor the Senate passed a freestanding FY2023 defense appropriations bill. The House Appropriations Committee (HAC), after 18 Subcommittee on Defense hearings from March to May 2022, voted 32-26 on June 22, 2022, to introduce such a bill (H.R. 8236) with an accompanying report (H.Rept. 117-388) comparing committee funding decisions to DOD’s requested amounts. Upon introduction, the House took no further action on that bill. The Senate Appropriations Committee (SAC) held eight Subcommittee on Defense (SAC-D) hearing sessions from March to June 2022. Concurrent with publication of the SAC chairman’s mark on the committee’s website, SAC-D Chairman Senator Jon Tester introduced an FY2023 defense appropriations bill (S. 4663) on July 28, 2022, on which neither the full Appropriations Committee nor the Senate took further action. Bicameral, bipartisan negotiations produced a final version of the defense appropriations bill, which, along with the texts of 11 other appropriations bills, was substituted for the text of H.R. 2617 by process of amendment. The defense bill was designated as Division C of the resulting Consolidated Appropriations Act, 2023, which the Senate passed on December 22, 2022, by a..."
Rights-of-Way for Access On or Through Tribal Lands,8/26/25,Mariel J. Murray; Benjamin M. Barczewski,www.congress.gov/crs-report/IF12825,"Congress has constitutional authority over issues relating to federally recognized Tribes (hereinafter, Tribes), which it has used to regulate access on and through tribal lands. In addition, the federal government has a federal trust responsibility to protect tribal treaty rights, lands, assets, and water resources on behalf of Tribes and tribal citizens (e.g., Seminole Nation v. United States, 316 U.S. 286, 296-297 (1942)). Pursuant to these mandates, the Bureau of Indian Affairs (BIA) within the Department of the Interior (DOI) oversees the process for granting rights-of-way (ROWs) on or through tribal lands. An ROW is a kind of easement, or nonpossessory legal right to use or control land for a particular purpose. An ROW provides a right to the easement holder to pass through property owned by another—in this case, tribal land. This CRS product discusses BIA’s ROW process and selected issues for Congress. Overview of Tribal Lands The federal trust responsibility and various statutes make tribal lands a unique form of property in the American legal system. Each Tribe’s geographic location and history with the United States may impact current tribal land holdings. Many Tribes have reservations, which include lands reserved for a Tribe (or multiple Tribes) by treaty, statute, or other agreement. For tribally owned land within reservations, or in certain cases an area of land constituting the Tribe’s former reservation as defined by the Secretary of the Interior (25 C.F.R. §151.2), Tribes generally have the ability to decide how those lands are used. Tribal reservations may include a mix of tribal land types, such as trust lands, which are lands or interests in land that are held in trust by the federal government (BIA holds title to the land) for the benefit of a Tribe or tribal citizen. Trust lands generally may not be alienated or encumbered..."
Proposed Transfer of Space Aligned National Guard Units,5/14/24,Sarah Gee; Jennifer DiMascio,www.congress.gov/crs-report/IN12377,"On March 29, 2024, the Secretary of the Air Force (SECAF) submitted a legislative proposal (LP480) asking Congress to allow transfer of “covered space functions” of the Air National Guard (ANG) to the U.S. Space Force (USSF) and waive 32 U.S.C. §104(c) and 10 U.S.C. §18238, which generally require state governors to approve changes in the organization, allotment, relocation, or withdraw of National Guard units within their states. The National Guard Bureau (NGB) (the federal agency responsible for administration of the National Guard), governors from 50 states and 5 U.S. territories, and others oppose LP480. Congress may consider whether to accept, reject, or modify LP480 as part of the FY2025 National Defense Authorization Act (NDAA). Background The FY2020 NDAA, P.L. 116-92, Subtitle D, established USSF as an armed service within the Department of the Air Force (DAF). Upon USSF establishment in 2019, space functions of the Air Force, and the Departments of the Army and Navy, transferred to the USSF. Some space functions remained in the Air National Guard (ANG). Congress has not enacted legislation to transfer space functions from the ANG to the USSF or to establish a Space National Guard. FY2024 NDAA, Section 924, directed the Secretary of Defense to study “the feasibility and advisability of transferring the space components of the Air National Guard to the Space Force,” and address three courses of action (1) maintaining the current model with ANG units and personnel performing space functions; (2) transferring ANG space functions, including units and personnel, to the USSF; and (3) establishing a Space National Guard. The resulting study, dated April 2024, recommends “transfer of covered space functions from the ANG to the Space Force,” including nine units totaling 578 positions in six states (see Table 1). Table 1. DAF Recommended Air National Guard Units for Space..."
